URL,Version,Status,OIDs,Name,Title,Descriptino,Uses,Used,Sources
http://hl7.org/fhir/ValueSet/administrative-gender,4.0.1,active,"2.16.840.1.113883.4.642.3.1",AdministrativeGender,AdministrativeGender,"The gender of a person used for administrative purposes.","StructureDefinition/Patient-HPA,StructureDefinition/Practitioner-HPA","hl7.fhir.r4.core"
http://hl7.org/fhir/ValueSet/body-site,4.0.1,draft,"2.16.840.1.113883.4.642.3.141",SNOMEDCTBodyStructures,SNOMED CT Body Structures,"This value set includes all codes from [SNOMED CT](http://snomed.info/sct) where concept is-a 442083009 (Anatomical or acquired body site (body structure)).","StructureDefinition/ObservationHealthConsultation-HPA,StructureDefinition/Condition-HPA,StructureDefinition/ObservationSmokingStatus-HPA,StructureDefinition/ObservationDepression-HPA,StructureDefinition/ObservationKidneyStage-HPA,StructureDefinition/ObservationWaist-HPA,StructureDefinition/ObservationHeight-HPA,StructureDefinition/ObservationBMI-HPA,StructureDefinition/ObservationPressure-HPA,StructureDefinition/ObservationWeight-HPA,StructureDefinition/ObservationLab-HPA,StructureDefinition/ObservationHealthBehavior-HPA","SCT"
http://hl7.org/fhir/ValueSet/bundle-type,4.0.1,active,"2.16.840.1.113883.4.642.3.620",BundleType,BundleType,"Indicates the purpose of a bundle - how it is intended to be used.","StructureDefinition/Bundle-HPA","hl7.fhir.r4.core"
http://hl7.org/fhir/ValueSet/clinical-findings,4.0.1,draft,"2.16.840.1.113883.4.642.3.232",SNOMEDCTClinicalFindings,SNOMED CT Clinical Findings,"This value set includes all the ""Clinical finding"" [SNOMED CT](http://snomed.info/sct) codes - concepts where concept is-a 404684003 (Clinical finding (finding)).","StructureDefinition/DiagnosticReport-HPA","SCT"
http://hl7.org/fhir/ValueSet/composition-attestation-mode,4.0.1,draft,"2.16.840.1.113883.4.642.3.238",CompositionAttestationMode,CompositionAttestationMode,"The way in which a person authenticated a composition.","StructureDefinition/Composition-HPA","hl7.fhir.r4.core"
http://hl7.org/fhir/ValueSet/composition-status,4.0.1,draft,"2.16.840.1.113883.4.642.3.241",CompositionStatus,CompositionStatus,"The workflow/clinical status of the composition.","StructureDefinition/Composition-HPA","hl7.fhir.r4.core"
http://hl7.org/fhir/ValueSet/condition-category,4.0.1,draft,"2.16.840.1.113883.4.642.3.162",ConditionCategoryCodes,Condition Category Codes,"Preferred value set for Condition Categories.","StructureDefinition/Condition-HPA","THO"
http://hl7.org/fhir/ValueSet/condition-clinical,4.0.1,draft,"2.16.840.1.113883.4.642.3.164",ConditionClinicalStatusCodes,Condition Clinical Status Codes,"Preferred value set for Condition Clinical Status.","StructureDefinition/Condition-HPA","THO"
http://hl7.org/fhir/ValueSet/condition-code,4.0.1,draft,"2.16.840.1.113883.4.642.3.161",Condition/Problem/DiagnosisCodes,Condition/Problem/Diagnosis Codes,"Example value set for Condition/Problem/Diagnosis codes.","StructureDefinition/Condition-HPA","SCT"
http://hl7.org/fhir/ValueSet/condition-severity,4.0.1,draft,"2.16.840.1.113883.4.642.3.168",Condition/DiagnosisSeverity,Condition/Diagnosis Severity,"Preferred value set for Condition/Diagnosis severity grading.","StructureDefinition/Condition-HPA","SCT"
http://hl7.org/fhir/ValueSet/condition-stage,4.0.1,draft,"2.16.840.1.113883.4.642.3.170",ConditionStage,Condition Stage,"Example value set for stages of cancer and other conditions.","StructureDefinition/Condition-HPA","SCT"
http://hl7.org/fhir/ValueSet/condition-stage-type,4.0.1,draft,"2.16.840.1.113883.4.642.3.171",ConditionStageType,Condition Stage Type,"Example value set for the type of stages of cancer and other conditions","StructureDefinition/Condition-HPA","SCT"
http://hl7.org/fhir/ValueSet/condition-ver-status,4.0.1,draft,"2.16.840.1.113883.4.642.3.166",ConditionVerificationStatus,ConditionVerificationStatus,"The verification status to support or decline the clinical status of the condition or diagnosis.","StructureDefinition/Condition-HPA","THO"
http://hl7.org/fhir/ValueSet/contact-point-system,4.0.1,active,"2.16.840.1.113883.4.642.3.71",ContactPointSystem,ContactPointSystem,"Telecommunications form for contact point.","StructureDefinition/Patient-HPA,StructureDefinition/Practitioner-HPA,StructureDefinition/Organization-HPA","hl7.fhir.r4.core"
http://hl7.org/fhir/ValueSet/contact-point-use,4.0.1,active,"2.16.840.1.113883.4.642.3.73",ContactPointUse,ContactPointUse,"Use of contact point.","StructureDefinition/Patient-HPA,StructureDefinition/Practitioner-HPA,StructureDefinition/Organization-HPA","hl7.fhir.r4.core"
http://hl7.org/fhir/ValueSet/contactentity-type,4.0.1,draft,"2.16.840.1.113883.4.642.3.416",ContactEntityType,Contact entity type,"This example value set defines a set of codes that can be used to indicate the purpose for which you would contact a contact party.","StructureDefinition/Organization-HPA","THO"
http://hl7.org/fhir/ValueSet/data-absent-reason,4.0.1,active,"2.16.840.1.113883.4.642.3.5",DataAbsentReason,DataAbsentReason,"Used to specify why the normally expected content of the data element is missing.","StructureDefinition/ObservationHealthConsultation-HPA,StructureDefinition/ObservationSmokingStatus-HPA,StructureDefinition/ObservationDepression-HPA,StructureDefinition/ObservationKidneyStage-HPA,StructureDefinition/ObservationWaist-HPA,StructureDefinition/ObservationHeight-HPA,StructureDefinition/ObservationBMI-HPA,StructureDefinition/ObservationPressure-HPA,StructureDefinition/ObservationWeight-HPA,StructureDefinition/ObservationLab-HPA,StructureDefinition/ObservationHealthBehavior-HPA","THO"
http://hl7.org/fhir/ValueSet/diagnosis-role,4.0.1,draft,"2.16.840.1.113883.4.642.3.49",DiagnosisRole,DiagnosisRole,"This value set defines a set of codes that can be used to express the role of a diagnosis on the Encounter or EpisodeOfCare record.","StructureDefinition/Encounter-HPA","THO"
http://hl7.org/fhir/ValueSet/diagnostic-report-status,4.0.1,draft,"2.16.840.1.113883.4.642.3.235",DiagnosticReportStatus,DiagnosticReportStatus,"The status of the diagnostic report.","StructureDefinition/DiagnosticReport-HPA","hl7.fhir.r4.core"
http://hl7.org/fhir/ValueSet/diagnostic-service-sections,4.0.1,draft,"2.16.840.1.113883.4.642.3.234",DiagnosticServiceSectionCodes,Diagnostic Service Section Codes,"This value set includes all the codes in HL7 V2 table 0074.","StructureDefinition/DiagnosticReport-HPA","THO (V2)"
http://hl7.org/fhir/ValueSet/document-relationship-type,4.0.1,draft,"2.16.840.1.113883.4.642.3.244",DocumentRelationshipType,DocumentRelationshipType,"The type of relationship between documents.","StructureDefinition/Composition-HPA","hl7.fhir.r4.core"
http://hl7.org/fhir/ValueSet/encounter-admit-source,4.0.1,draft,"2.16.840.1.113883.4.642.3.257",AdmitSource,Admit source,"This value set defines a set of codes that can be used to indicate from where the patient came in.","StructureDefinition/Encounter-HPA","THO"
http://hl7.org/fhir/ValueSet/encounter-diet,4.0.1,draft,"2.16.840.1.113883.4.642.3.255",Diet,Diet,"This value set defines a set of codes that can be used to indicate dietary preferences or restrictions a patient may have.","StructureDefinition/Encounter-HPA","THO"
http://hl7.org/fhir/ValueSet/encounter-discharge-disposition,4.0.1,draft,"2.16.840.1.113883.4.642.3.259",DischargeDisposition,Discharge disposition,"This value set defines a set of codes that can be used to where the patient left the hospital.","StructureDefinition/Encounter-HPA","THO"
http://hl7.org/fhir/ValueSet/encounter-location-status,4.0.1,draft,"2.16.840.1.113883.4.642.3.262",EncounterLocationStatus,EncounterLocationStatus,"The status of the location.","StructureDefinition/Encounter-HPA","hl7.fhir.r4.core"
http://hl7.org/fhir/ValueSet/encounter-participant-type,4.0.1,draft,"2.16.840.1.113883.4.642.3.250",ParticipantType,Participant type,"This value set defines a set of codes that can be used to indicate how an individual participates in an encounter.","StructureDefinition/Encounter-HPA","THO (V3),THO"
http://hl7.org/fhir/ValueSet/encounter-reason,4.0.1,draft,"2.16.840.1.113883.4.642.3.261",EncounterReasonCodes,Encounter Reason Codes,"This examples value set defines the set of codes that can be used to indicate reasons for an encounter.","StructureDefinition/Encounter-HPA","SCT"
http://hl7.org/fhir/ValueSet/encounter-special-arrangements,4.0.1,draft,"2.16.840.1.113883.4.642.3.253",SpecialArrangements,Special arrangements,"This value set defines a set of codes that can be used to indicate the kinds of special arrangements in place for a patients visit.","StructureDefinition/Encounter-HPA","THO"
http://hl7.org/fhir/ValueSet/encounter-special-courtesy,4.0.1,draft,"2.16.840.1.113883.4.642.3.252",SpecialCourtesy,Special courtesy,"This value set defines a set of codes that can be used to indicate special courtesies provided to the patient.","StructureDefinition/Encounter-HPA","THO (V3)"
http://hl7.org/fhir/ValueSet/encounter-status,4.0.1,draft,"2.16.840.1.113883.4.642.3.246",EncounterStatus,EncounterStatus,"Current state of the encounter.","StructureDefinition/Encounter-HPA","hl7.fhir.r4.core"
http://hl7.org/fhir/ValueSet/encounter-type,4.0.1,draft,"2.16.840.1.113883.4.642.3.248",EncounterType,Encounter type,"This example value set defines a set of codes that can be used to indicate the type of encounter: a specific code indicating type of service provided.","StructureDefinition/Encounter-HPA","THO"
http://hl7.org/fhir/ValueSet/http-verb,4.0.1,active,"2.16.840.1.113883.4.642.3.624",HTTPVerb,HTTPVerb,"HTTP verbs (in the HTTP command line). See [HTTP rfc](https://tools.ietf.org/html/rfc7231) for details.","StructureDefinition/Bundle-HPA","hl7.fhir.r4.core"
http://hl7.org/fhir/ValueSet/identifier-type,4.0.1,active,"2.16.840.1.113883.4.642.3.45",Identifier Type Codes,IdentifierType,"A coded type for an identifier that can be used to determine which identifier to use for a specific purpose.","StructureDefinition/Encounter-HPA,StructureDefinition/ObservationKidneyStage-HPA,StructureDefinition/DiagnosticReport-HPA,StructureDefinition/ObservationWaist-HPA,StructureDefinition/ObservationBMI-HPA,StructureDefinition/ObservationHealthBehavior-HPA,StructureDefinition/ObservationHealthConsultation-HPA,StructureDefinition/Condition-HPA,StructureDefinition/ObservationSmokingStatus-HPA,StructureDefinition/ObservationDepression-HPA,StructureDefinition/Bundle-HPA,StructureDefinition/ObservationHeight-HPA,StructureDefinition/RiskAssessment-HPA,StructureDefinition/ObservationPressure-HPA,StructureDefinition/ObservationWeight-HPA,StructureDefinition/ObservationLab-HPA","THO (V2)"
http://hl7.org/fhir/ValueSet/identifier-use,4.0.1,active,"2.16.840.1.113883.4.642.3.57",IdentifierUse,IdentifierUse,"Identifies the purpose for this identifier, if known .","StructureDefinition/Patient-HPA,StructureDefinition/Encounter-HPA,StructureDefinition/ObservationKidneyStage-HPA,StructureDefinition/DiagnosticReport-HPA,StructureDefinition/ObservationWaist-HPA,StructureDefinition/ObservationBMI-HPA,StructureDefinition/ObservationHealthBehavior-HPA,StructureDefinition/ObservationHealthConsultation-HPA,StructureDefinition/Condition-HPA,StructureDefinition/ObservationSmokingStatus-HPA,StructureDefinition/Organization-HPA,StructureDefinition/Practitioner-HPA,StructureDefinition/ObservationDepression-HPA,StructureDefinition/Bundle-HPA,StructureDefinition/ObservationHeight-HPA,StructureDefinition/RiskAssessment-HPA,StructureDefinition/ObservationPressure-HPA,StructureDefinition/ObservationWeight-HPA,StructureDefinition/ObservationLab-HPA","hl7.fhir.r4.core"
http://hl7.org/fhir/ValueSet/languages,4.0.1,draft,"2.16.840.1.113883.4.642.3.20",CommonLanguages,Common Languages,"This value set includes common codes from BCP-47 (http://tools.ietf.org/html/bcp47)","StructureDefinition/Patient-HPA,StructureDefinition/Encounter-HPA,StructureDefinition/ObservationKidneyStage-HPA,StructureDefinition/DiagnosticReport-HPA,StructureDefinition/ObservationWaist-HPA,StructureDefinition/Composition-HPA,StructureDefinition/ObservationBMI-HPA,StructureDefinition/ObservationHealthBehavior-HPA,StructureDefinition/ObservationHealthConsultation-HPA,StructureDefinition/Condition-HPA,StructureDefinition/ObservationSmokingStatus-HPA,StructureDefinition/Organization-HPA,StructureDefinition/Practitioner-HPA,StructureDefinition/ObservationDepression-HPA,StructureDefinition/Bundle-HPA,StructureDefinition/ObservationHeight-HPA,StructureDefinition/RiskAssessment-HPA,StructureDefinition/ObservationPressure-HPA,StructureDefinition/ObservationWeight-HPA,StructureDefinition/ObservationLab-HPA","hl7.terminology.r4"
http://hl7.org/fhir/ValueSet/link-type,4.0.1,active,"2.16.840.1.113883.4.642.3.423",LinkType,LinkType,"The type of link between this patient resource and another patient resource.","StructureDefinition/Patient-HPA","hl7.fhir.r4.core"
http://hl7.org/fhir/ValueSet/list-empty-reason,4.0.1,draft,"2.16.840.1.113883.4.642.3.322",ListEmptyReasons,List Empty Reasons,"General reasons for a list to be empty. Reasons are either related to a summary list (i.e. problem or medication list) or to a workflow related list (i.e. consultation list).","StructureDefinition/Composition-HPA","THO"
http://hl7.org/fhir/ValueSet/list-mode,4.0.1,draft,"2.16.840.1.113883.4.642.3.318",ListMode,ListMode,"The processing mode that applies to this list.","StructureDefinition/Composition-HPA","hl7.fhir.r4.core"
http://hl7.org/fhir/ValueSet/list-order,4.0.1,draft,"2.16.840.1.113883.4.642.3.324",ListOrderCodes,List Order Codes,"Base values for the order of the items in a list resource.","StructureDefinition/Composition-HPA","THO"
http://hl7.org/fhir/ValueSet/location-physical-type,4.0.1,draft,"2.16.840.1.113883.4.642.3.328",LocationType,Location type,"This example value set defines a set of codes that can be used to indicate the physical form of the Location.","StructureDefinition/Encounter-HPA","THO"
http://hl7.org/fhir/ValueSet/manifestation-or-symptom,4.0.1,draft,"2.16.840.1.113883.4.642.3.169",ManifestationAndSymptomCodes,Manifestation and Symptom Codes,"Example value set for Manifestation and Symptom codes.","StructureDefinition/Condition-HPA","SCT"
http://hl7.org/fhir/ValueSet/marital-status,4.0.1,active,"2.16.840.1.113883.4.642.3.29",Marital Status Codes,MaritalStatus,"This value set defines the set of codes that can be used to indicate the marital status of a person.","StructureDefinition/Patient-HPA","THO (V3)"
http://hl7.org/fhir/ValueSet/name-use,4.0.1,active,"2.16.840.1.113883.4.642.3.65",NameUse,NameUse,"The use of a human name.","StructureDefinition/Patient-HPA,StructureDefinition/Practitioner-HPA","hl7.fhir.r4.core"
http://hl7.org/fhir/ValueSet/observation-category,4.0.1,draft,"2.16.840.1.113883.4.642.3.403",ObservationCategoryCodes,Observation Category Codes,"Observation Category codes.","StructureDefinition/ObservationHealthConsultation-HPA,StructureDefinition/ObservationSmokingStatus-HPA,StructureDefinition/ObservationDepression-HPA,StructureDefinition/ObservationKidneyStage-HPA,StructureDefinition/ObservationWaist-HPA,StructureDefinition/ObservationHeight-HPA,StructureDefinition/ObservationBMI-HPA,StructureDefinition/ObservationPressure-HPA,StructureDefinition/ObservationWeight-HPA,StructureDefinition/ObservationLab-HPA,StructureDefinition/ObservationHealthBehavior-HPA","THO"
http://hl7.org/fhir/ValueSet/observation-codes,4.0.1,draft,"2.16.840.1.113883.4.642.3.396",LOINCCodes,LOINC Codes,"This value set includes all LOINC codes","StructureDefinition/ObservationHealthConsultation-HPA,StructureDefinition/ObservationSmokingStatus-HPA,StructureDefinition/ObservationDepression-HPA,StructureDefinition/ObservationKidneyStage-HPA,StructureDefinition/DiagnosticReport-HPA,StructureDefinition/ObservationLab-HPA,StructureDefinition/ObservationHealthBehavior-HPA","LOINC"
http://hl7.org/fhir/ValueSet/observation-interpretation,4.0.1,active,"2.16.840.1.113883.4.642.3.399",ObservationInterpretationCodes,Observation Interpretation Codes,"A categorical assessment, providing a rough qualitative interpretation of the observation value,    such as “normal”/ “abnormal”,”low” / “high”, “better” / “worse”, “susceptible” / “resistant”, “expected”/ “not expected”.    The value set is intended to be for ANY use where coded representation of an interpretation is needed.             Notes:          This is being communicated in v2.x in OBX-8 (Observation Interpretation), in v3 in ObservationInterpretation (CWE) in R1 (Representative Realm) and in FHIR in    Observation.interpretation. Historically these values come from the laboratory domain, and these codes are extensively    used. The value set binding is extensible, so codes outside the value set that are needed for interpretation concepts    (i.e. particular meanings) that are not included in the value set can be used, and these new codes may also be added to    the value set and published in a future version.","StructureDefinition/ObservationHealthConsultation-HPA,StructureDefinition/ObservationSmokingStatus-HPA,StructureDefinition/ObservationDepression-HPA,StructureDefinition/ObservationKidneyStage-HPA,StructureDefinition/ObservationWaist-HPA,StructureDefinition/ObservationHeight-HPA,StructureDefinition/ObservationBMI-HPA,StructureDefinition/ObservationPressure-HPA,StructureDefinition/ObservationWeight-HPA,StructureDefinition/ObservationLab-HPA,StructureDefinition/ObservationHealthBehavior-HPA","THO (V3)"
http://hl7.org/fhir/ValueSet/observation-methods,4.0.1,draft,"2.16.840.1.113883.4.642.3.395",ObservationMethods,Observation Methods,"Observation Method codes from [SNOMED CT](http://snomed.info/sct) where concept is-a 272394005 (Technique (qualifier value)) or is-a 129264002 (Action (qualifier value)) or is-a 386053000 (Evaluation procedure(procedure))","StructureDefinition/ObservationHealthConsultation-HPA,StructureDefinition/ObservationSmokingStatus-HPA,StructureDefinition/ObservationDepression-HPA,StructureDefinition/ObservationKidneyStage-HPA,StructureDefinition/ObservationWaist-HPA,StructureDefinition/ObservationHeight-HPA,StructureDefinition/ObservationBMI-HPA,StructureDefinition/ObservationPressure-HPA,StructureDefinition/ObservationWeight-HPA,StructureDefinition/ObservationLab-HPA,StructureDefinition/ObservationHealthBehavior-HPA","SCT"
http://hl7.org/fhir/ValueSet/observation-status,4.0.1,active,"2.16.840.1.113883.4.642.3.400",ObservationStatus,ObservationStatus,"Codes providing the status of an observation.","StructureDefinition/ObservationHealthConsultation-HPA,StructureDefinition/ObservationSmokingStatus-HPA,StructureDefinition/ObservationDepression-HPA,StructureDefinition/ObservationKidneyStage-HPA,StructureDefinition/ObservationWaist-HPA,StructureDefinition/RiskAssessment-HPA,StructureDefinition/ObservationHeight-HPA,StructureDefinition/ObservationBMI-HPA,StructureDefinition/ObservationPressure-HPA,StructureDefinition/ObservationWeight-HPA,StructureDefinition/ObservationLab-HPA,StructureDefinition/ObservationHealthBehavior-HPA","hl7.fhir.r4.core"
http://hl7.org/fhir/ValueSet/observation-vitalsignresult,4.0.1,active,"2.16.840.1.113883.3.88.12.80.62",VitalSigns,Vital Signs,"This value set indicates the allowed vital sign result types.   The LOINC code for Vitals Signs panel (85353-1) is a grouping structure for a set of vital signs and includes related links (with type=has-member) to the Observations in this set (e.g. respiratory rate, heart rate, BP).  The Blood pressure panel (85354-9) is used to group the component observations Systolic blood pressure (8480-6) and Diastolic blood pressure (8462-4).","StructureDefinition/ObservationHeight-HPA,StructureDefinition/ObservationBMI-HPA,StructureDefinition/ObservationPressure-HPA,StructureDefinition/ObservationWeight-HPA","LOINC"
http://hl7.org/fhir/ValueSet/organization-type,4.0.1,draft,"2.16.840.1.113883.4.642.3.414",OrganizationType,Organization type,"This example value set defines a set of codes that can be used to indicate a type of organization.","StructureDefinition/Organization-HPA","THO"
http://hl7.org/fhir/ValueSet/quantity-comparator,4.0.1,active,"2.16.840.1.113883.4.642.3.59",QuantityComparator,QuantityComparator,"How the Quantity should be understood and represented.","StructureDefinition/ObservationHeight-HPA,StructureDefinition/ObservationBMI-HPA,StructureDefinition/ObservationPressure-HPA,StructureDefinition/ObservationWeight-HPA","hl7.fhir.r4.core"
http://hl7.org/fhir/ValueSet/referencerange-appliesto,4.0.1,draft,"2.16.840.1.113883.4.642.3.407",ObservationReferenceRangeAppliesToCodes,Observation Reference Range Applies To Codes,"This value set defines a set of codes that can be used to indicate the particular target population the reference range applies to.","StructureDefinition/ObservationHealthConsultation-HPA,StructureDefinition/ObservationSmokingStatus-HPA,StructureDefinition/ObservationDepression-HPA,StructureDefinition/ObservationKidneyStage-HPA,StructureDefinition/ObservationWaist-HPA,StructureDefinition/ObservationHeight-HPA,StructureDefinition/ObservationBMI-HPA,StructureDefinition/ObservationPressure-HPA,StructureDefinition/ObservationWeight-HPA,StructureDefinition/ObservationLab-HPA,StructureDefinition/ObservationHealthBehavior-HPA","SCT"
http://hl7.org/fhir/ValueSet/referencerange-meaning,4.0.1,draft,"2.16.840.1.113883.4.642.3.397",ObservationReferenceRangeMeaningCodes,Observation Reference Range Meaning Codes,"This value set defines a set of codes that can be used to indicate the meaning/use of a reference range for a particular target population.","StructureDefinition/ObservationHealthConsultation-HPA,StructureDefinition/ObservationSmokingStatus-HPA,StructureDefinition/ObservationDepression-HPA,StructureDefinition/ObservationKidneyStage-HPA,StructureDefinition/ObservationWaist-HPA,StructureDefinition/ObservationHeight-HPA,StructureDefinition/ObservationBMI-HPA,StructureDefinition/ObservationPressure-HPA,StructureDefinition/ObservationWeight-HPA,StructureDefinition/ObservationLab-HPA,StructureDefinition/ObservationHealthBehavior-HPA","THO"
http://hl7.org/fhir/ValueSet/relatedperson-relationshiptype,4.0.1,draft,"2.16.840.1.113883.4.642.3.449",PatientRelationshipType,Patient relationship type,"A set of codes that can be used to indicate the relationship between a Patient and a Related Person.","StructureDefinition/Patient-HPA","THO (V3),THO (V2)"
http://hl7.org/fhir/ValueSet/resource-types,4.0.1,active,"2.16.840.1.113883.4.642.3.27",ResourceType,ResourceType,"One of the resource types defined as part of this version of FHIR.","StructureDefinition/Composition-HPA","hl7.fhir.r4.core"
http://hl7.org/fhir/ValueSet/risk-probability,4.0.1,draft,"2.16.840.1.113883.4.642.3.450",RiskProbability,Risk Probability,"Codes representing the likelihood of a particular outcome in a risk assessment.","StructureDefinition/RiskAssessment-HPA","THO"
http://hl7.org/fhir/ValueSet/search-entry-mode,4.0.1,active,"2.16.840.1.113883.4.642.3.622",SearchEntryMode,SearchEntryMode,"Why an entry is in the result set - whether it's included as a match or because of an _include requirement, or to convey information or warning information about the search process.","StructureDefinition/Bundle-HPA","hl7.fhir.r4.core"
http://hl7.org/fhir/ValueSet/service-type,4.0.1,draft,"2.16.840.1.113883.4.642.3.518",ServiceType,Service type,"This value set defines an example set of codes of service-types.","StructureDefinition/Encounter-HPA","THO"
http://hl7.org/fhir/ValueSet/ucum-bodylength,4.0.1,draft,"2.16.840.1.113883.4.642.3.958",BodyLengthUnits,Body Length Units,"UCUM units for recording body length measures such as height and head circumference","StructureDefinition/ObservationHeight-HPA","UCUM"
http://hl7.org/fhir/ValueSet/ucum-bodyweight,4.0.1,draft,"2.16.840.1.113883.4.642.3.956",BodyWeightUnits,Body Weight Units,"UCUM units for recording Body Weight","StructureDefinition/ObservationWeight-HPA","UCUM"
http://hl7.org/fhir/ValueSet/ucum-vitals-common,4.0.1,draft,"2.16.840.1.113883.4.642.3.955",VitalSignsUnits,Vital Signs Units,"Common UCUM units for recording Vital Signs","StructureDefinition/ObservationWaist-HPA,StructureDefinition/ObservationHeight-HPA,StructureDefinition/ObservationBMI-HPA,StructureDefinition/ObservationPressure-HPA,StructureDefinition/ObservationWeight-HPA","UCUM"
http://hl7.org/fhir/uv/ips/ValueSet/absent-or-unknown-problems-uv-ips,1.1.0,active,,AbsentOrUnknownProblemsUvIps,Absent or Unknown Problems - IPS,"Absent or Unknown Problems","StructureDefinition/Condition-HPA","hl7.fhir.uv.ips"
http://terminology.hl7.org/ValueSet/v2-0092,2.0.0,active,"2.16.840.1.113883.21.40",Hl7VSReAdmissionIndicator,hl7VS-re-admissionIndicator,"Value Set of codes which are used to specify that a patient is being re-admitted to a healthcare facility from which they were discharged, and indicates the circumstances around such re-admission.","StructureDefinition/Encounter-HPA","THO (V2)"
